{
  "canonical_account_id": "acc_singtel_001",
  "product_id": "prd_sgt_001",
  "master_product_id": "mprd_group_connectivity",
  "bundle_product_id": "bndl_enterprise_fabric",
  "brand_id": "brand_singtel",
  "brand_name": "Singtel Enterprise",
  "relationship_type": "OWNED",
  "is_active": true,
  "run_id": "run_public_regional_20260328",
  "run_timestamp": "2026-03-28T09:00:00Z",
  "model_version": "dc-canonical-v2.1.0"
}
